Title,Review,Rating
Clare's Thirsty Ale,"The last thing I expected to be at FOBAB was an old whale I never thought I would tick, but here we are and I'm so happy!Despite all that, I can settle myself and dig in. As I do, here in this 8 ball black, short mocha headed ale, I get chocolate raspberry sticks and not a ton of barrel. There's just a little bite of slightly herbal wood, which I think more than anything helps to bring us to a powder dry finish.I can see how this would have made the news in its heyday (see what I did there?), but in today's world of absolute confections and bombastic feats of oak, it's quite underwhelming.",4.6
Clare's Thirsty Ale,Can courtesy of JohnnyHops.,4.43
Clare's Thirsty Ale,"Part of the wonderful deluge of midwest goodies sent my way by @FBarber during NBS BIF #13.Gorgeous pour. Body traps light. Completely dark. Lovely finger of soft dark brown foam. Quite the beaut.Nose has lovely rich velvety espresso with vanilla and milk chocolate and sure enough there's a hint of raspberries layered in there as well. Inviting.The berries are much more prevalent here, beginning at the first sip. It starts off as just kind of a general berry/fruit sweetness that builds alongside the other components I will get to in a moment to reveal a jammy decidedly raspberry note. We'll come back to this later. The build alongside this has silky espresso and dark chocolate as well as a hint of vanilla and spice and oak from the barrel. This brings us back to the raspberry. You know how raspberries are actually kind of tart alongside their juicy sweetness? It's one of the great things about them, is they offer a balance and a range of experience, and that presents here. The finish has some bitter from the coffee, and a bit of pucker that feels like the raspberry tartness joining the oakiness of the barrels and a bit of alcohol astringency (that works well in this situation to accentuate the other flavours listed there) to give it a little 'ooh!' to the finish. Really enjoyable.Body is velvety smoothe, and that tart finish I descibe above fades to leave behind some of the dark chocolate bitterness and a slight reminder of the alcohol contained therein. Would not descibe it as hot, but it isn't shy about it's double digit ABV.I'm really enjoying this. Raspberry and chocolate are such a natural seeming pairing, but I feel like I still don't see it quite as often as I'd expect, in beer. I think it really really works well here, and am grateful to have had the opportunity to try it. Thanks Frank!",4.5
Oude Geuze Cuvée Armand & Gaston,"The beer pours a very bubbly white head that dissipates very quickly. The beer itself is a clear brownish orange color that looks nice.The smell is very good. It has an orange note upfront with a bit of funk and oak underneath it.The taste is delicious. It has a strong orange note with a light funk and light toffee finish. There is a light oak note to it.The feel is very good. The beer has a light body to it but a good texture so that it doesn't feel thin. It has a tinglingsensation. The acidity is really nice. It's very similar to that of orange juice; not taxing for the average person.Overall, a fantastic gueuze that's perfect for the hot weather to drink or to have something during the day. It isn't overly taxing on the palate.",3.98
Oude Geuze Cuvée Armand & Gaston,"Blend no. 77, season 17|18, bottled 21 sep 18 (based on the ""best before"" date, this is 2018-09-21), corked and caged 750ml bottle.Clear golden orange, fizzy low head. Smells funky and bright, dirt floor plus flower. Tastes, wow, so much going on. Crisp acidity plus funk, some overripe fruit flavors, coming in waves. Feel is outstanding - light and tingly but lasting on the tongue. Really good stuff.",4.41
Oude Geuze Cuvée Armand & Gaston,"375 ml bottle - Season 17/18 Blend No. 80poured a slightly cloudy orange golden in color, with off-white colored head. pretty good head retention. aroma and flavor a nice blend of sharp fruity tartness and dry oak tannins and a little funk. nice complexity. medium bodied, average carbonation.",4.41
Oude Geuze Cuvée Armand & Gaston,"Bottled in 2018, drank from a Teku glass. A most excellent Geuze. Complex flavors, with a hint of clove and some good sourness (but not too much). Very drinkable and refreshing despite its great body and complexity. I will try to find another bottle and let it age longer.",4.5
Oude Geuze Cuvée Armand & Gaston,"Blend No 57 - season 16|17 - wort from 9 different brews, aged in 8 different barrels - bottled November 14th 2017 - enjoyed on December 31, 2022. Poured from a caged-and-corked 750mL bottle into my Drie de Fonteinen tumbler.Not quite clear amber body with an active champagne fist receding to a small fine cap. Vague, sloppy lacing; no legs. Very good retention.Subtle yet complex aroma - herbaceous and floral with a delicate funk bringing to mind superior washed rind cheese.Palate entry brings to mind alfalfa fields, sorrel, and salty sea breezes. Tart but not bracingly so. Low earthy bitterness comes and goes. Goat milk, lanolin, crisp malt, and raw nuts. Finishes dry with earth, minerality, umami, and a hint of funk.Medium-light bodied, well carbonated, nearly refreshing, but still soft.Hard to find a more authentic example of the style - rich, complex, rustic yet refined. Reasonable value given the time and labor involved. A good candidate for aging indefinitely.",4.75
Oude Geuze Cuvée Armand & Gaston,"Pours a rich, light orange with ample visible carbonation and a light collar of foam. Nose is extremely funky and expressive with elements of dried and wet hay, fresh cut crash, menthol, wood chips, pine, and sap. The aroma continually evolves and builds on itself throughout the course of the drink. Taste follows with an equal complexity and expresses many of those notes from the nose. There's a deep earthiness that underlies it as well, evocative at one moment of the smells of a forest floor or the flavor of a cave aged cheese the next. Overall, this beer does not stop working until it's gone. Remarkable and easily one of the best.",5
Imperial German Chocolate Cupcake Stout,"Bottom line: this is a delectable pastry stout worthy of Angry Chair's lofty reputation. They simply seem to have mastered some sort of alchemy regarding the style that few, if any, can match.It's perhaps not a dead ringer for the namesake dessert ... but it honestly isn't far off, and the resemblance grows with successive sips. It's sweet, but not cloying; realistically, it's more rich and decadent than sweet. The coconut is a lovely light touch, never overbearing, but adding another layer to the profile. Chocolate and vanilla are prominent, joined by molasses, cherry, and caramel from the malt base. Incredibly long finish, including lingering notes of coffee, chocolate, and vanilla.This is another absolute home run from Angry Chair. Every single time I have one of their highest-rated pastry stouts, I think there's absolutely no way it can possibly live up to the hype ... and then it not only matches, but surpasses the hype.",4.5
Imperial German Chocolate Cupcake Stout,"From a 32oz crowler, filled at the brewery 06/03/23. Served in a tulip.Pours a thick-and-viscous appearing motor oil black. A scant quarter-finger of coffee-colored suds lasts a half-minute or so, leaving a soft, creamy collar and a barely rousable oily, sugary film of super-slippery lacing.Nose is roasty-malty, nutty and mildly sweet. Aromas of fudge and dark roast coffee. Some nuttiness and woody, husky coconut as it warms.Taste is fudgy-sweet - but much less sweetness than anticipated. Tasting brown sugar chocolate vanilla fudge, molasses-sweetened coffee and - more prominently and notably as the beer warms - an earthy, woody nuttiness, ground bitter walnut, thick and heavy perfumy vanilla and husky coconut. Nice! Alcohol is hardly noticeable.Feel is smooth and viscous, dense but less thick and heavy than it appeared going into the glass! with super-fine, prickly carbonation making it feel a little lighter than it might otherwise. I want to say that it feels ‘sugary,’ like sugar water but that’s totally hallucinatory - it tastes like it should feel sugary but it does not. Abv is hardly evident.Overall, outstanding! I like to buy these sweet and sticky pastry stouts mainly so that I can complain about them and leave bad reviews but this was so damn good that I was wishing I hadn’t offered to share it with Boy and Spouse. Mammosilenus, who never likes stouts, stole several ounces of this and then came back looking for more and had to be beaten back.",4.98
Imperial German Chocolate Cupcake Stout,"Such an awesome beer! Like most of Angry Chair's stouts, this thing coated the glass with sugar, making it difficult to hold without developing sticky fingers. This is offset completely by the delicious, deep chocolate nose and palette, with boozy sweetness grabbing hold and a light aftertaste of vanilla.",4.58
Imperial German Chocolate Cupcake Stout,"Dark black, little to no head. Imperial German Chocolate Cupcake Stout is super sweet, and not my favorite kind of stout. This needs the barrel. It's tasty - I split this 4 ways, so still got about 6oz, and it was probably 3oz too many. Total dessert stout. Good for what what it is - not for me.",4.75
Imperial German Chocolate Cupcake Stout,Sampled 11/8/2019 while in line at Toppling Goliath. Chocolate greatness.,4.33
Double Stack,"L: Pours a thick oily black with a small tan head that dissipates quickly and leaves no laci g on the glass.S: Cinnamon pancakes drenched in maple syrup with a side of coffee.T: Sweet syrup, mixes with chocolate and a slightly bitter coffee. Aroma is a little better than taste.F: Smooth cola like body.O: This definitely hits the pancakes and syrup taste.",4.25
Double Stack,"4.29/5: The aroma and flavor both have a fantastic maple presence, yet the coffee and roasted malts do just enough to keep the sweetness in check",5
Double Stack,"everything about this beer is great pours dark with big head(pour slowly) great maplely - malty smell., flavvor is outsstanding great malt maple taste - not strong slightly sweet",4.6
Double Stack,"A - Pours pitch black with a thin tan head. Light soapy lacing.S - Aroma is black coffee, roasted malts and maple.T - The taste is black coffee, vanilla, maple, dark chocolate and bitter roasted malts.M - Medium body with medium carbonation. Soft crisp mouthfeel with a sticky dry finish.O - Really solid. Less sweet than expected.",4.52
Double Stack,"A Tavour Treat. Pours a dark brown color with a minimal head that disappears quickly. Aroma is maple syrup and roasted malts. Taste is sweet coffee, maple, vanilla and cinnamon. Smooth and creamy.",4.5
Double Stack,Look - Black with a great than head and great sticky lacing and rimmingSmell & Taste - Maple forward followed by chocolate and coffee with a rosted malt as well.Feel - full body creamy lighter carbOverall - really taste like liquid panackes with maple syrup and some coffee,4.5
Double Stack,"Double Stack from Great Notion. 16 fl oz can from @snaotheus in NBW BIF 17. Reviewed 14/05/23 (Review 3101). Note that I use DD/MM/YY protocol.Top rim of can stamped “STICKY STACKS 03.06.23”. Stored at 34 degrees at home. Served at 46.2 degrees F in a hand washed and dried Jester King snifter. The final temperature was 54.5 degrees F.Appearance – 4.25First pour – Amber Brown (SRM 18), clear.Body – Black (SRM 40), opaque. Under direct light, same. When rear lite, opaque with light penetration at the edges – ruby.Head: Average (Maximum 1.1 cm, aggressive center pour), tan, high density, quickly diminishing, reducing to a 0.2 cm crown constantly renewed by carbonation, and a thin partial cap.Lacing – Poor. Thin line of near-microscopic bubbles.Aroma – 4.5 – When the tab is popped, instant aroma of coffee and maple syrup! Weak roasted malt, no hops, no yeast. No ethanol (11 % ABV as marked on the label).Flavor – 3.5 – Moderately bitter coffee with maple syrup flavor as backing. Bitterness enhanced by the char flavor. No malt, no yeast, no hops. No dimethylsulfide or diacetyl. Slight gastric warming.Palate – 4 – Medium; watery short of syrupy/creamy; soft carbonation.Final impression and summation: 4 Without the char bitterness, I would have rated the flavor 4.5; for my taste buds, the char nearly ruined the maple/coffee combo. Otherwise, this is a very good coffee stout. And that “natural flavor and caramel color” screams “Unnecessary crap added”.",4.36
Double Stack,"Canned 3/6/23. ""Sticky stacks"" stamped on the side of the canIt's finally time to try this classic from Great Notion thanks to Tavour. It's their most reviewed beer on BA and their only one to have entered the top 250. This should be their magnum opus. Will it be? Let's crack it open and find outPours a very dark brown with 2 fingers of creamy dark tan head that slowly fades to a ring and leaves minimal lacingThis is absolutely a maple bomb in the nose, but the coffee plays a nice supporting role as well. I'm picking up on aromas of maple syrup, milk chocolate, burnt caramel, medium roast coffee, vanilla, brown sugar, and straight up pancakesIt's surprisingly much more bitter in taste compared to the nose, not to say that it's super bitter but it has a nice bite. On the front end of the sip I'm tasting raw maple, dark roast coffee, charred malt, vanilla, cocoa powder, molasses, light raisin, and brown sugar. The swallow brings notes of maple syrup, dark roast coffee, cacao nibs, burnt caramel, charred malt, dark toast, and light molassesA medium full body pairs with gentle tingling carbonation, resulting in a sweet beer with a bite. Finishes a tad sticky but nothing that hurts the drinkabilityIt's not reinventing the wheel of maple adjuncted Stouts, but it's damn good nonetheless",4.42
Double Stack,"Very dark brown color. Aroma is very maple forward with a lot of vanilla, pastry, and coffee notes. Flavor is amazing, so sweet and so much going on— again with the coffee, vanilla, and maple… also toffee and caramel notes. Low bitterness. Very full body with some astringency. Holy crap, would get again, it’s so good! Taking lactase enzyme preemptively with this one because I am concerned.",4.21
Double Stack,"On tap at The Brass Tap, Cedar Falls, IA. Served in a 5-ounce snifter. Pitch black in color, with a thin tan head. Absolutely huge aromas and flavors of maple syrup, dark roast coffee, pancakes, and char. Lots of roasty malt bitterness, without much attendant sweetness. Slightly boozy, with a syrupy mouthfeel. Notes of bitterness and char linger on the palate long after the finish. Overall, well crafted and highly recommended.",4.29
Double Stack,"Aroma gives off a strong, alluring waft of maple and chocolatey malt. Taking a drink feels like getting a huge bite out of a big, fluffy, delicious Belgian waffle coated in maple syrup, followed by a roasty bite of coffee. Nothing I've ever had comes so close to the maple taste, every sip is a breakfast meal in one. Top tier!",4.5
Double Stack,"Can poured into a Mountain Rambler Brewery snifterA: Pours basically black with a frothy tan brown head that settles to a thin layer and leaves some thin lacing.S: Opening the can is like opening the door to a sugar shack as you're met with a wave of maple, followed by bold coffee, roasty malt, a little char, and faint smoke, light earthy notes, chocolate, vanilla, toffee, and slightly toasty biscuity bready pancake-y-ness.T: Opens with a huge hit of maple syrup, followed by milk chocolate, vanilla, and a nice touch of coffee that leads into roasty malt, a little char, and a touch of smoke, with underlying mild earthy and slightly nutty notes, toffee, and toasty biscuity/bready malt very reminiscent indeed of a stack of pancakes.M: Full body, somewhat mild carbonation, pretty smooth though somehow I would describe it as especially creamy, alcohol is rather well hidden giving just the slightest touch of warmth as it comes up to room temp.O: I've had a couple cans of this sitting in the fridge for a few years now, just waiting for the right night to crack into my special liquid souvenirs from a great road trip. But as time passed and that night never came, I got on the lookout for a fresh can to purposely do the opposite with; to push to the front of the line as quickly as possible and try fresh. A lucky shipment of cans hit my area recently, so here we are, cracking into a can that's a little more than a month old.This beer probably has the strongest maple presence of any beer I've ever had, including CBS. To their credit, you definitely get the sensation of taking a big bite of pancakes dripping with syrup after just taking a sip of your morning mocha. Unfortunately, that kinda leads into its downfall. While it is true to their own description of having an ""extreme maple syrup flavor"", it can come off as ungodly sweet up front. Not gonna lie, I'm also a little weary of the label saying ""coffee, maple syrup, natural flavor, and caramel color"", potentially meaning there's some kinda maple or 'pancake extract' in there. This one is fun to try, but could really benefit from some balance; upping the coffee, backing the maple down a notch, maybe even both would help make it less of a novelty and more of an enjoyable sipper you go back to. Maybe some age will do the trick. I'll definitely update when that right night comes along and I get into my vintage cans. For now, I'd say it's a cool one to try as a short pour, but it can get overwhelming in greater volumes.",4.25
Thicket,"Blend #1, on tap at the cellar. Nice and tart. Just funky enough. Wine barrels did this well. Quite enjoyable. Would really like to contract with Blend #2 eventually.",4.33
Barrel-Aged Silhouette,"2019 bottle, Drank 7/31/23Pours dark black, zero carbonation. Strong pleasant aroma of chocolate and molasses. Taste is much of the same with an added hint of coffee and bourbon barrel. Feel is thin, and FLAT which really distracts from this being a top BA stout for me. Overall it’s ok taste wise, but maybe 4 years old was way to long to wait on this one",4.35
Barrel-Aged Silhouette,"Lift Bridge Silhouette Barrel Aged Imperial Stout. 2014. Bottle Number 239. 750 ml. 1 Pint, 9.4 fluid ounces. Alc. 10% by Volume. Aged in bourbon barrels. Brewed and bottled by Lift Bridge Brewing Company in Stillwater, MN, USA. ""The Cold War is over. Serve at 55-60. Degrees. (I still don't know the key for that one.) I will skip the the gobbledygook until later.(Note: this is one of those very rare occasions when I don't have a photo of the beer I consumed to go along with the notes. I plugged in the iPod touch that use to take them and found nothing. How is this possible? It's part of my regular routine, I never forget to take the pictures. Could I have accidentally deleted them somehow? That's even less likely. Perhaps I was just so excited to drink the beer that I forgot to take that essential early step in my ritual. So, once I realized there were no photos, I fished the empty bottle out of the recycling, and posed it next to the as yet un-washed glass I drank it from. That's not even the true beer in there, I followed Silhouette with another bottle.I bought this two weeks ago at the brewery. Wish I had another to save and age and savor in the future, but this is the one, and I'm drinking it now. (I'd actually never even heard of this beer, must have been sleeping or something when it was released last year.)Solid blackness in this one (the darkest beer I've had from this brewery), with a rich, roast tan head that starts big, slims down and stays awhile.Aroma leaps out and spills the bourbon all over the place. Additional notes of charcoal, molasses, caramel, toffee, dark fruit, …vanilla. Always vanilla. And I like it.Taste: Ah, mmm, and yeah, huh. Deepness and richness in abundance. This has got everything it needs and it lasts and lasts. Immensely indulgent. Chocolate and espresso and everything dark and deep and delicious. MMM, I'll say it again. And what else? Licorice. We call it anise sometimes. And all those other things.It's a thing of hugeness and a richness and wonderfully rewarding to the drinker. this is all relative. I am loving this and this is not a chore at all, it is a delight. If you want to read about a chore, check my review of Stone's Crime and Punishment. Yikes, talk about trial and error!Hey, let's read the gobbledygook. ""Silhouette is as deep and dark as the Northern woods. It's brewed in the style of an Imperial Stout. Aromas of coffee, chocolate, molasses and prune meld with a unique dark roasted character. . The beer is complex, rich and full bodied. It's wild spirit will warm the senses, illuminate the soul, and grow into a traditional favorite…no matter what season.""",4
Barrel-Aged Silhouette,"2020 bottling, 12 oz bottle.I walked on by this beer many times in the store because I considered it to be overpriced (yeah, I know... it's a ""99 World-Class"" here, but we're suckers for a BA Imperial stout...).Anyhow, in a weak moment, I did order one from my favorite curb-side pickup store a while back, and it sat in my 'fridge, and sat, until I finally moved it to the cellar to make room for other beers.It's back in the refrigerator for Cellaruary.So, today is the day. I won't be able to compare it to the beer fresh, though, since this is my first tasting of this beer.Taken from a ~42° refrigerator and allowed to warm for 30 minutes or so unopened. Drinking started at mid-50°'s (a guess).Opaque black topped by a ½ inch creamy-appearing dark tan head with short retention. Little visible carbonation and what lacing does appear with a tip of the glass quickly slides back down into the tan ring. The ring eventually disappears completely, leaving a still surface.Very strong aroma. Bourbon first, then barrel. Molasses. Slight hint of vanilla.Rich flavor, mirroring the aroma. Bourbon, oak, vanilla, sweet molasses. Adding to the party is roasted malts and dark fruits. Toward the finish and into the aftertaste, dark chocolate appears along with the alcohol, slightly warming my mouth in the after. The finish is sweet vanilla and dark chocolate.The body is substantial, approaching viscous (but not quite getting there).Overall, this BA stout is excellent, indeed. A rich aroma and flavor, a substantial body, lots of bourbon and barrel without overpowering the underlying Imperial stout flavors, a sweet, but controlled sweetness, finish. It's not a dessert beer, but an excellent evening sipping beer. If I'm feeling like splurging, I may actually buy it again!",4.75
Barrel-Aged Silhouette,"REview#1600,This thing is all barrel, but that's not a bad thing in this case. If I had to say something bad about it I would say it is sorta harsh and abrasive at times, overpowering and (this sounds dumb) kinda too smooth at other times... unbeer-like if that makes sense, tastes like some sort of new better drink that supersedes beer into a more betterer territory",4.33
Barrel-Aged Silhouette,"Pours black with leakage to mahogany brown on the edges and a tan head. The nose has oaky, boozy barrel notes, some dark chocolate, and stone fruit.The barrel is forward on the taste, coasting into the dark chocolate and stone fruit notes, which works really well. The mouthfeel is full, but just the slightest bit watery. Overall, thought this is outstanding.",4.73
Barrel-Aged Silhouette,"#83, good stuff!",4.69
Barrel-Aged Silhouette,"A slight fizz, but then no head. Nearly black, pours thick.Smell is a sweet molasses and caramel.Taste is smooth, balanced. Not as complex as some, but still extremely flavorful. Plum and molasses.Feel is outstanding. Creamy and silky smooth.An excellent beer!",4.5
Bomb!,"L: Pours a dark hickory, forms no head and a very thin espresso ring around the edge of the snifter. No noticeable lacing or retention, with a distinctive oily character. Has a crunchy, dark chocolate hue when held to the light.S: Cacao nibs, bourbon barrel, oak, vanilla, and coffee. Hints of chili heat.T: Strong coffee roast, cacao nibs, vanilla, and roasted malts. Slightly astringent. Faint chili burn in finish.F: Medium- to full-bodied. Thick, creamy mouthfeel. Moderate carbonation.O: The sun rises in the east, Prairie delivers another outstanding stout.",4.34
Bomb!,"Got a bottle of this from Charleston Beer Exchange years ago. Finally getting a chance to try it and I am stocked. I have had this fresh on draft but that was probably 6 years ago and I was unable to get a review done.Pours pitch black with a small, wispy toffee colored head. Sporadic lacing. Aroma is coffee and chocolate and figs and alcohol. Mouthfeel is a little thin for my liking. Slightly watered down but wonderful flavor overall. I enjoyed the draft version more and this bottle was a bit of a letdown. Solid beer but plenty better.",4.4
Bomb!,"Look: exceptionally dark brown, almost black. Very thin mocha colored head, minor lacing.Smell: very well-mixed chocolate and vanilla fight for dominance. Moderately strong coffee and malt.Taste: follows the nose. The chocolate, vanilla, coffee, and malt sweetness are all present. Nothing is overpowering. No real taste of chile peppers until the back end (see feel).Feel: rich, silky, velvety, and smooth. Low carbonation as expected given the style and the 13% abv. Warmth from the alcohol during and after swallow. Tingling spice on the tongue (from the chile peppers) long after the swallow.Overall: one of the best - and possibly THE best - adjunct imperial stout I have ever had the fortune of trying. Exquisitely well-balanced flavors.",4.09
Bomb!,"This one is rich, dark and creamy. I taste all the flavors except the heat from the chiles. Maybe since it's a year old the chiles have subsided. Still a fantastic brew.",4.89
