Title,Review,Rating
Fuzzy,"I'm finding I am really enjoying white peaches specifically in wild ales, just lend themselves to barrel, funk and botanicals so well. Here SP has done well to allowing the juicy peach tones shine too. Smell is damn impressive: sour peach, yogurt, barnyard, and barrel funks, bright and rustic oak, pressed flowers, dry earth, a touch of lemon and lime zest, and finished with big hay. Taste is more sour and less complex with funk losing the barrel variety to the sour fruits, otherwise the same with sneaky complexity yet potent. Feel is sour and decently acidic, but gentle, dries out with various funks, almost feels more pungent than it tastes or smells. Clear yellow body with a pinky finger of white foam. This is right up there with the best peach wild ales, little less acidity and it could be the very top",4.5
Fuzzy,"2022 vintageHere we are, the #1 Wild Ale on BA for my 1500th review! This is a special one that has been a long time want for me, so I’m very excited to finally try it. I’ve only had a few Side Project beers, but they’ve all been fantastic so I have no reason to think this one wouldn’t be. Let’s get into itPours a cloudy pale gold with 2 fingers of whitehead that quickly fades to a ring and leaves no lacingThis is certainly tart in the nose, but it has a surprisingly nice balance to it. I'm picking up on aromas of tart peach, lemon yogurt, sharp oak, tannic white wine, straw, bready malt, wildflower honey, apple skin, light vinegar, stone, and even a touch of smokeIn taste it starts off with a balanced tartness similar to the aroma, and on the back end explodes with an aggressive flash of tartness before settling down once again. On the front end of the sip I'm tasting jammy peach, lemon juice, vanilla, wet hay, straw, smooth oak, leather, and white grape. The swallow brings notes of tart peach, lemon juice, crabapple, white wine vinegar, sharp oak, wet hay, vanilla, bready malt, and light peat smokeA medium body pairs with gentle tingling carbonation, resulting in a puckering beer. Finishes a tad sticky but dries out over timeOh yeah, this is damn good. Despite the not so good looks, everything else here is awesome. A truly unique beer",4.5
Fuzzy,"Appearance - The beer was the color of a peach. It was orange with red hues toward the center.Smell - The beer smelled like sour peaches. There was an undercurrent of sweetness, like vanilla.Taste - The profile was quite acidic, like a soured peach. Notes of peach and peach skin were detected. There seemed of be the presence of vanilla sweetness as well. The profile had a nice sour peach finish.Mouthfeel - The body had little carbonation, but a pleasant smoothness.Overall - This is a sour that I can enjoy, and I am not a sour guy.",4.53
Fuzzy,"This was a guest beer on tap during the 2021 Zwanze Day celebration I attended.2020 Fuzzy, at a year’s age.Loved the nose on this. Stone fruit in season, white peach and a hint of funk. It’s tart, without being overly sour, with a nuanced finish. More of the peach notes, leaving the palate tingling. Fantastic.",4.4
Fuzzy,"A: Tangerine pour with fiery hues to apricot. The neck films a shade of macaroon cream that’s dismissive per inscription, from the preset retention. Howbeit, an irksomeness to turns offers lace docility, as the intervals thermally protract. There’s a touch of transparency upon the settlements of course, while effervescence becomes a mobilized varianceS: Pierced rusticity for white peach with esterification authorities. Illustrated by, a bitingly tart eruption that’s tamed enough for the developing – wild yeast – appearances. The progression opts for some grainy malt to the motivated horsed phenols, which quietly idle funk steps. Principally, satchels and farmstalls with soiled mold. Nonetheless, acidity is tenacious on fruit bouquets, as the lactic stability is detrimental to frowzy quirks. There’s elements of solvency thru the open air drafts, which incriminate nail polish and naphtha agents. On the other hand, that piece is often stupefied, given the peppery phenol attunement to floral hops, and biscuit-y malt brackets to stone fruit mineralsT: A clean, consecutive, punch-down stomp that puts natural peaches in vanguard. Notations subtly follow in ripening depictions of Goldrich apricots and Armking nectarines, while briny minerals perimeter Neptune grass. In correlation, an engine for Eugenol to promptly pump in cloves and nutmeg, while maintaining that peppery attenuation. The ongoing drive is earthy and persistently bright, with calming acidity on the advances of rural funk. To that end, the move adds haystacks atop the citrus connotations, but keeps that musty jazz in a distant place. Aerial attacks begin setting in, from oak dragged elasticities, and prompt in some leathery satchels. Whilst, Chardonnay attenuates a staleness for Budapestlängd with an oxidative nuttinessM: Does not puncture with puckered acridity, but rather maintains a level of energy that rationally aids. Namely, a backend for rustic brettanomyces, and a pillar for biscuit-y grains. The approach is brisk in carbonation, as the approach is crisp in sensation. Thus, cleanly bright with minor overextensions in the presetting bites, but pleasingly uplifting in the dry – erosional – reliefsO: Showcases clean peach natures with a caustic effervescence that’s costly to the preliminary entwines, of wild yeast. Though, development is rapid enough to calm the impaling authorities, and make rational moves. In this situation, light malts provide an aid to earthy hop kicks, while acclimating spiced esters with musty phenols. The approach is thereby tart with brett funk complexions, and spurs wooded fruit tannins on an astutely dry/crisp exhibition",4.22
Fuzzy,Look - Great clear golden color with a slight white skimmingSmell - nice slight peach wild ale smellTaste - Fantastic peach easy going slight tartFeel - Crisp with a medium bodyOverall - just fantastic,4.32
Fuzzy,Excelent beer,4.81
Fuzzy,Bottle generously shared by Seth. Cloudy pale yellow pour with a white head. Sour peach aromas. Big tart/sour notes with peach highlights. Lemon zest and citrus lowlights. Good body and mouthfeel.,4.73
Nectarine Premiere,"Poured from a 750ml bottle into an oversized wine glassLook: A hazy orange with a very thin white head that dissipates quickly.Smell: Sweet and fresh nectarine hits the nose immediately. This fades into a buttery oak with some hay like funk. A little salty and mildly acidic.Taste: Nectarine juice shocks the palate that fades to a buttery oak. This is punched aside by a lightly briny sour note that fades to more nectarine stone fruit notes on the finish.Feel: Bright, clean, mildly acidic. No alcohol noted. Light carbonation.Overall: A beautiful and clean sour. The brewery really knows what they are doing!",4.37
Nectarine Premiere,"6/2019 Batch! Sweet and tart, fruity-yeasty funky, a hint of oak-barrel, and a nice and sweet, nectarine stonefruity nose on this one! Nice aromatics! Taste follows with a well-balanced, slightly briny, oak and under-ripe tart nectarine finish. The oak barrel is pretty well integrated at this point...I was just hoping for a little more jammy-sweet nectarine on the palate. Delicious!",4.32
Nectarine Premiere,21-Oct,4.85
Nectarine Premiere,"Bottled September 2020Alright folks, here we are, the final BIF beer I received from @Eziel! It’s been a wild 6 months of hard to find beers, and we’re ending with the heaviest hitter of the bunch. This is currently the 5th highest rated Saison on BA and 52nd overall. Those are some impressive stats. Also, I’m not sure if I’ve ever seen a beer fruited with only nectarine, it’s usually a blend. Let’s get into itPours an opaque orange gold with 2 fingers of creamy off white head that very quickly fizzes away to nothing and leaves no lacingSheesh, less than stellar appearance aside, this is bold in the nose, just super fruity and tart with a big funk too. I'm picking up on aromas of sweet nectarine, wet hay, tart apricot, sharp oak, lemon yogurt, wildflower honey, straw, and crackery maltOh man, the funk is even punchier in taste, but not in a way that's out of balance. On the front end of the sip I'm tasting tart peach, lemon juice, white wine vinegar, stone, sharp oak, nectarine, wet hay, honey, and lemongrass. The swallow brings notes of wet hay, stone, white wine vinegar, peach pit, nectarine, sharp oak, crackery malt, lemon yogurt, and light orange juiceA medium body pairs with moderate carbonation, resulting in a sharp and zippy beer. Finishes bone dry with a lovely balance of sour fruit and funkWow, this is one hell of a beer! It's highly complex, yet I could chug it. But why would I do that? I plan on nursing this bottle over the course of the night",4.5
Aaron,2016 bottling.,4.41
Aaron,"Bottle generously shared by Seth. Dark brown pour with a kaki head. Big booze and caramel malt aromas. Big booze, caramel malts, and dark fruit highlights. Wow, this is fantastic. Mild oak and vanilla sub tones. Complex with a great body and mouthfeel. An incredible example of this style.....",4.51
Aaron,DLD - 5/18/2019,4.63
Aaron,"Vintage 2016, Bottled July 2018, Drank March 2021Look - Dark, reddish brown. Minimal to no headSmell - Sweet, with notes of Toffee, brown sugar, & raisinsTaste - Toffee, Rasin, Tobacco, a hint of chocolate and a finish of bourbon barrel. Sweet and smooth with minimal alcohol burn. Medium carbonationFeel - Creamy and thickOverall - Really impressed, and this was a real treat. I have not had a lot of barleywines, but certainly everything in the future will be compared to this.",4.44
KBS,"Looks: Beautiful, tan, creamy head over dark brown beer.Smell: Coffee, bourbon, alcohol, just a little subduedTaste: This is not subtle. Sweet without being sugary. Bourbon, coffee, chocolate and some alcohol. More balanced than something like Dragon’s Milk that is a little too sugary.Feel: Thick and just a little effervescent.Overall: Yum. My favorite stout, I think.",4.86
KBS,"Not much left to say. The barrel flavors are there, and they’re not vaguely barrel-like. Oh, and it’s not a sugar bomb. The feel is what stands out the most. Creamy full, and slightly alcoholic at the end. Fantastic.",4.21
KBS,"This is one of my favorite beers I have ever had. It has become my standard to compare other stouts, but nothing has compared to Founders so far. My only complaint is that there seems to be slight differences in taste and feel from batch to batch. However, there is a good chance that it's just a misperception on my part. I have always enjoyed every single one. This one is pretty pricey, but it's worth it 100%.",4.7
KBS,"Really good stout, rivals Dragons Milk which is my favorite readily available stout. Dragons milk has a little bit of a sweet note that I don’t love, and I didn’t detect that with KBS. I do think KBS has a stronger alcohol taste, but I only noticed it on the first couple drinks. Very easy to drink beer, for being 12 ABV.",4.44
KBS,Not for all but all must try.Dark chocolate and coffee fun welcome.,4.79
KBS,"KBS always pours great, deep dark black and smells really great if you like bourbon. The mouth feel is a medium body with that bourbon smell turning into a subtle taste. Becomes more dark chocolate bitter forward as you drink it. The fresher the beer the more bite the bourbon taste has.",5
KBS,"Super good, but not as good as the Toppling Goliath ...",4.36
Bourbon County Brand Stout,"Goose Island Bourbon County imperial stout.Now I must say, this is quite quite good. Like very good. Somewhere between a good stout and an aged whiskey, which isn't a surprise based on the drink itself. That being said, it does not exemplify the thing I like most about beer so far being, drinkability. I do like the refreshing nature of a beer quite a bit and that is the only thing I'd say is absent here.At 14.3 percent, it's quite high for a beer, and you feel a lingering alcohol taste towards the end. It is accompanied by some sweet notes like date and chocolate though.Mouthfeel is very unique in that somehow the bubbles feel thick. Like the consistency is buttery and but the bubbles feel heavy for some reason bringing out a very odd and unique, but not off putting, almost soupy texture. Mouthfeel end notes are sticky and also a little velvety or caramel-like.Smell is a little sour and very malt forward, slightly fruity and even slightly-er herby.If you haven't tried it, I highly recommend. I've been sipping as I write this and am appreciating it more and more. One hell of a beer. If you do grab one, the only thing I can say is that it's not smashable, but should be enjoyed slowly.",4.81
Bourbon County Brand Stout,"Finally getting to try this. 2022 vintage, poured from bottle into a snifter.Look: Black-brown-red, thick, oily. Very thin light brown head, no retention except a tiny ring.Smell: Oh wow. Damn, this is pulling no punches. Chocolate, coffee, caramel, malt, bourbon, dark bread, and the tiniest hints of vanilla beans, raisins, and bananas. Incredibly complex.Taste: YUUUUUP. Heavyweight, but incredibly smooth at the same time. Lots of the chocolate, with the vanilla bean and caramel notes playing second and third fiddle. Heavy maltiness and bourbon character, but still incredibly smooth with very little burn for the ABV. Raisin note is slightly present in the back, as well as the faintest banana peeking through once the malt onslaught begins to fade.Feel: Thick but only slightly oily on the palette, light but lingering carbonation. Sticks around a bit, but in a pleasant way and doesn't overstay its welcome. Very slightly syrupy. Really pleasant.Overall: Masterclass of an imperial stout. Has more distinct flavour impressions than most stouts with adjuncts, but is still perfectly balanced. Deserves the hype.",4.5
Bourbon County Brand Stout,"Opened the 2019 bottle that has been aging in my cellar. Poured into a tulip glass. The chocolate colored head quickly dissipated. Midnight color, smell was extraordinary complex consisting of a beautiful bouquet of chocolate, alcohol, fine whiskey, and espresso. Taste was exceedingly complex. The stout lingered on my palate forever, it seemed. Take your time to sip this beauty as it has a high alcohol content. Overall, a warm stout to enjoy in the midst of a winter storm, near a fireplace. Well done.",4.46
Bourbon County Brand Stout,"2022.A- Pours a beautiful black oily color, perfectly opaque. Hardly any headS-Wow. Rich chocolate, plums, oak,espresso, a bit of whiskey. Probably the best smelling beer I’ve had the pleasure of smelling.T-Chocolate, bourbon, oaky goodness, raisins, coffee. Can’t believe this is 14.5 percent ABV.M- Rich and oilyO- It’s incredible. It lives up to the hype.",4.55
Bourbon County Brand Stout,"Pours a deep brown, nearly black.The smell is very reminiscent of whiskey due to the barrel aging. Slight alcohol tinge, but very fruity and sweet smelling. The smell is like raisins or figs. There is a slight fermentation flavor that reminds me of wine, likely due to the high ABV.The flavor is very sweet and low in bitterness. The flavor is extremely malty, and fruity. The taste seems like a cross between a high malt beer, a wine, and a bourbon. Notes of figs, raisins, trailed by syruppy molasses and fermentation flavors.The mouthfeel is thick and syrupy.A very excellent beer",4.21
Bourbon County Brand Stout,"This is my favorite stout beer. Since I live in the Chicago area, it's easily accessible. I see some reviews that state KBS is as good or better. I'm writing this review to say that is false.",4.93
Bourbon County Brand Stout,"Pours very dark. Dark tan foam. Heavy bourbon aroma. Big flavors. Chocolate, caramel, and oak. Very complex but well balanced. Strong alcohol finish. Beyond excellent. Best imperial stout I've ever had.",4.59
Bourbon County Brand Stout,"Look: Pours obsidian black with a very light, copper-colored head.Smell: Strong whiskey and vanilla aromas, along with fudge and coffee.Taste: Silky smooth bourbon and vanilla taste, I’m also getting the hints of chocolate and coffee, and there is also some caramel going on as well. The oak is present as it goes down and just finished the taste perfectly.Feel: Man this is too smooth for how heavy it is. The feel is heavy but this is easily drinkable and just paints the palette with a velvety finish.Overall: Absolute dynamite for the style, this is one of the best out there and lives up to the hype.",4.61
Very HHHazyyy,"L - opaque hazy orange/yellow with a thin creamy white head that dissipates quickly leaving behind a good amount of lacingS - orange, mango, passion fruit, peaches, piney resinous hopsT - follows the nose - tons of orange and peach upfront with a little bit of passion fruit and mango, intermixed well with resinous, piney hopsF - full bodied with light carbonation. Smooth, soft, fluffyO - A fantastic NEIPA - one of the benchmarks for the style - a little more nuance to the flavor profile compared to Emperor Julius",4.5
Very HHHazyyy,On tap at the Tewksbury location. Sublimely smooth white packing an absolute ton of dank yummy citrus and fruit. I've really run out of superlatives for TH sauce these days. Yum!!,5
Very HHHazyyy,Look - Nice thick honey orange with a thick frothy white head and stickySmell - Orange peach but not as much as I was expectingTaste - nice blend between orange ripe peach mango (in that order) with a very slight biteFeel - medium body creamy with a slight carb. Nice mouth coating sticks to it all.Overall - really a fantastic beer. Wish the smell was more but all and all fantastic,4.23
Very HHHazyyy,"What TH says on the can I 100% agree. Very Hqzy is one of my top rated beers from TH and, in my taste bud opinion, this is better. I lucked out on 5/18 when I was at the TREE and this was available. Yay o’Yay. Great beer and I hope it’s available on one of my few trips to TH.",4.68
Very HHHazyyy,"If you like prototypical hazy ipas, this is the one. Super soft on the pallette. Ripe stone fruits and pineapple abound, something like an umbrella drink. Truly a sensational beer that somehow stands apart from the rest.",4.6
Flora Plum,Solid beer - a bit plum tart aftertaste.,4.59
Flora Plum,"Original bottlingIt is a clear, reddish plum pour with half a finger of pure white head. It looks less thick than many of the HF saisons I have tried, but ""prettier"".Tart plum bursts from the bottle and fills the room. As I pour it gets even stronger. My salivary glands fire before I even put nose to glass. Such a delicious aroma, it calls, entices, with fresh plum, tart sourdough, raspberry jam, grape must notes, honeysuckle, hints of spicy alcohol and fresh flowers, in perfect balance to create a stunning aroma.All the flavors of the nose are here, no need to repeat them, balanced perfectly, in a wonderful blend. It ends a lightly jammy whih fades into a tart, fruity linger. As it warms hints of an herbal bitterness enter the mix, quite lightly, and it gets even better.Medium body for style, light carbonation which works well here, clean as a whistle, with a brilliantly flavored linger that is just right to bring on desire for next sip.Another masterpiece from the master I regret not tasting fresh. It has either remained or become a beauty of a beer that is an artistic work of intoxicating refreshment",4.9
Flora Plum,"After Flora Pear, this is my favorite Flora. Excellent barrel character has been imparted into the beer. Pours a beautiful deep gold, big wine nose, effervescent with plums dancing in the background. Fantastic.",4.59
Flora Plum,"Pours a straw gold. Nose of plum, Lemon, hay, and traditional HF nose. Taste follows with a well blended plum, lemon, hay, minimal acid. Feel is light/medium with medium carb. Overall, this is an excellent fruit beer that is well balanced with the base beer.",4.14
Headroom,"Canned 8/29/23 and shipped to PADefinitely think it borders on living up to the hype - a very good hazy. Super soft and creamy; little grassier than I prefer my IPAs, but this is balanced enough that it's not a detraction nor is it over the top. Glad I finally got the tick on this one, but there are definitely other Trillium hazies I would prefer to this.",4.54
Headroom,Overrated. Highly disappointed. Huge letdown.,4.34
Headroom,Grapefruit sunny D. On draft at Churchkey.,4.36
Headroom,"Pours a very hazy fleshy peach color with a fluffy off white head that leaves ringlets of lace as you enjoy the beer. Gorgeous hazy.The nose is dank and packed with sweet peach aromas, orange peel, some grapefruit, and lots of mango and pineapple. This is literally a beer fruit basket of aromas.The peach flavors lead the taste and are delicious, with the orange, mango, and pineapple flavors following, with a bit of green grapes mid palate and a nice creamy oat flavor on the finish. Very balanced and oh so delicious.The mouthfeel is full, soft, and creamy, adding to the drinkability. This is a magnificent representation of the style, IMHO.",4.3
Headroom,"On tap:Cloudy bruised peach with a typical hazy head that clings to the edges pretty well. Nose is melon and unripe tropical fruits midway through without any agitation. Giving the beer a swirl ripens the fruits pretty quickly, giving a sweeter impression overall (some sniffs expose an overripe burn, but it’s not the norm).When cold, the beer opens with an almost tart fruit note, which contrasts poorly with the more bitter middle and finish. It doesn’t completely disappear as the beer warms, but it does mellow out and blend in better. The sweetness notes in the nose after a swirl pervades the opening through to near the finish, reducing the contrast, but taking the bitterness I enjoyed in the back end of a colder beer.This beer went from a disjointed start with highs and lows to a more balanced, but also more typical, very good hazy.",4.75
Headroom,"On tap, pours a beautiful hazy glowing orange. Smell is an immediate assault of fresh grapefruit, followed by layers of berry and a touch of dank. Taste follows. Feel is smooth and dang near perfect. No booze, no burn. Outstanding.",4.6
Atrial Rubicite,"Atrial Rubicite? Yeah, I’m not going to even try with that. You might as well tell Raul to read James Joyce. Either way, like a drunk Irishmen at the pub, this one is a bullseye. It’s perfect in nature like nature.Carry one, my children.",4.72
Atrial Rubicite,"Blend #11 from May 2021, 5.1% ABV from a 750mL bottle. Just about perfect for a wild ale for me, still a delightful balance of pure, jammy fruit essence, bacterial sourness and funk, and oak tartness. This is what raspberries are made for.",4.5
Atrial Rubicite,3/31/23 On tap at Jester King.Beautiful ruby red. No lacing or head. Beautiful raspberry/cherry sourness. Borders on wine. Lacto fermentation briny-ness.,4.52
Atrial Rubicite,"Blend 12 from a bottle and split between two people. This had been on my want list for a long time and it lived up to every expectation I had for it. Beautiful colour & aroma, super jammy taste and packed a solid sour bite.",4.91
